{
  "schema": "zaentrum.library.extra/2",
  "extraId": "b859d931-1df7-5c71-9ecb-27ef457db863",
  "createdAt": "2026-09-19T08:00:00Z",
  "createdBy": "ingest example",
  "kind": "featurette",
  "title": "On Location in Amsterdam",
  "localizedTitles": {
    "de": "Drehort Amsterdam",
    "nl": "Op locatie in Amsterdam"
  },
  "language": "en",
  "runtimeMs": 300000,
  "originalFiles": [
    "Tears of Steel (2012) - On Location in Amsterdam.mkv"
  ],
  "originals": [
    {
      "name": "Tears of Steel (2012) - On Location in Amsterdam.mkv",
      "sizeBytes": 90,
      "fixity": {
        "qh1": "sha256:1230dc2746c92025f671f4558fb7a03132b6d772d34c3cb361c50c6d1cbdecad",
        "sha256": "sha256:289ad230f595f54b9e4201c7a38ae1c973252aa6d493d0ff13da2ebfada90e3a",
        "sha256At": "2026-09-19T08:00:00Z"
      }
    }
  ],
  "container": {
    "format": "matroska,webm",
    "durationMs": 300000,
    "bitrate": null,
    "title": null,
    "muxingApp": null,
    "writingApp": null,
    "creationTime": null,
    "tags": {}
  },
  "streams": [
    {
      "index": 0,
      "type": "video",
      "codec": "h264",
      "language": null,
      "languageRaw": null,
      "title": null,
      "dispositions": {
        "default": true
      },
      "profile": "Main",
      "level": null,
      "bitDepth": 8,
      "pixelFormat": "yuv420p",
      "width": 1920,
      "height": 800,
      "sampleAspectRatio": "1:1",
      "displayAspectRatio": null,
      "frameRate": "24/1",
      "fieldOrder": "progressive",
      "bitrate": null,
      "colour": {
        "primaries": "bt709",
        "transfer": "bt709",
        "matrix": null,
        "range": "tv"
      },
      "hdr": {
        "format": "sdr",
        "masteringDisplay": null,
        "contentLightLevel": null,
        "dolbyVision": null
      },
      "stereo3d": null,
      "closedCaptions": false,
      "encoder": null
    },
    {
      "index": 1,
      "type": "audio",
      "codec": "aac",
      "language": "en",
      "languageRaw": "eng",
      "title": null,
      "dispositions": {
        "default": true,
        "commentary": false
      },
      "profile": null,
      "channels": 2,
      "channelLayout": "stereo",
      "sampleRate": 48000,
      "bitDepth": null,
      "bitrate": null,
      "lossless": false,
      "objectAudio": "none",
      "titleClaim": null,
      "encoder": null,
      "purpose": "main",
      "purposeFrom": "assumed",
      "variant": null
    },
    {
      "index": 2,
      "type": "subtitle",
      "codec": "subrip",
      "language": "en",
      "languageRaw": "eng",
      "title": null,
      "dispositions": {
        "default": false,
        "forced": false,
        "hearingImpaired": false
      },
      "form": "text",
      "styled": false,
      "variant": null,
      "events": 120,
      "purpose": "dialogue",
      "purposeFrom": "assumed"
    }
  ],
  "fidelity": {
    "class": "original",
    "fingerprint": "h264/high/8bit/sdr/1920x800",
    "evidence": []
  },
  "essence": {
    "maxAudioChannels": 2,
    "surround": false,
    "losslessAudio": false,
    "objectAudio": false,
    "maxVideoHeight": 800,
    "videoBitDepth": 8,
    "hdr10Metadata": false,
    "dolbyVision": false,
    "stereo3d": false,
    "interlaced": false,
    "audioLanguages": [
      "en"
    ],
    "subtitleLanguages": [
      "en"
    ],
    "subtitleTracks": 1,
    "imageSubtitles": false,
    "styledSubtitles": false,
    "fonts": false,
    "chapters": false,
    "commentaryTracks": 0,
    "commentarySubtitles": 0,
    "audioDescriptionTracks": 0,
    "sdhSubtitleLanguages": [],
    "forcedSubtitleLanguages": [],
    "closedCaptions": false
  },
  "probe": {
    "tool": "ffprobe",
    "version": null,
    "at": "2026-09-19T08:00:00Z",
    "note": null
  }
}
