{
  "schema": "zaentrum.library.extra/2",
  "extraId": "ad2a8159-e086-582a-8274-b930fab861ca",
  "createdAt": "2026-09-19T10:00:00Z",
  "createdBy": "ingest example",
  "kind": "trailer",
  "title": "Trailer",
  "localizedTitles": {},
  "language": "en",
  "runtimeMs": 60000,
  "originalFiles": [
    "original.mkv"
  ],
  "originals": [
    {
      "name": "original.mkv",
      "sizeBytes": 52,
      "fixity": {
        "qh1": "sha256:6462ba0b40030bd4f91db04c8bccb735d353b9d6e5a10797c52802dfec1804a7",
        "sha256": "sha256:03a75c21bfce5900c1694cfa67c7df782f6e3c0c1329dedbb4de3620758133a2",
        "sha256At": "2026-09-19T10:00:00Z"
      }
    }
  ],
  "origin": {
    "kind": "link",
    "site": "example.org",
    "externalId": "tears-of-steel-trailer",
    "url": null,
    "fetchedAt": "2026-09-19T07:30:00Z"
  },
  "container": {
    "format": "matroska,webm",
    "durationMs": 60000,
    "bitrate": null,
    "title": null,
    "muxingApp": null,
    "writingApp": null,
    "creationTime": null,
    "tags": {}
  },
  "streams": [
    {
      "index": 0,
      "type": "video",
      "codec": "h264",
      "language": null,
      "languageRaw": null,
      "title": null,
      "dispositions": {
        "default": true
      },
      "profile": "Main",
      "level": null,
      "bitDepth": 8,
      "pixelFormat": "yuv420p",
      "width": 1920,
      "height": 800,
      "sampleAspectRatio": "1:1",
      "displayAspectRatio": null,
      "frameRate": "24/1",
      "fieldOrder": "progressive",
      "bitrate": null,
      "colour": {
        "primaries": "bt709",
        "transfer": "bt709",
        "matrix": null,
        "range": "tv"
      },
      "hdr": {
        "format": "sdr",
        "masteringDisplay": null,
        "contentLightLevel": null,
        "dolbyVision": null
      },
      "stereo3d": null,
      "closedCaptions": false,
      "encoder": null
    },
    {
      "index": 1,
      "type": "audio",
      "codec": "aac",
      "language": "en",
      "languageRaw": "eng",
      "title": null,
      "dispositions": {
        "default": true,
        "commentary": false
      },
      "profile": null,
      "channels": 2,
      "channelLayout": "stereo",
      "sampleRate": 48000,
      "bitDepth": null,
      "bitrate": null,
      "lossless": false,
      "objectAudio": "none",
      "titleClaim": null,
      "encoder": null,
      "purpose": "main",
      "purposeFrom": "assumed",
      "variant": null
    }
  ],
  "fidelity": {
    "class": "original",
    "fingerprint": "h264/high/8bit/sdr/1920x800",
    "evidence": []
  },
  "essence": {
    "maxAudioChannels": 2,
    "surround": false,
    "losslessAudio": false,
    "objectAudio": false,
    "maxVideoHeight": 800,
    "videoBitDepth": 8,
    "hdr10Metadata": false,
    "dolbyVision": false,
    "stereo3d": false,
    "interlaced": false,
    "audioLanguages": [
      "en"
    ],
    "subtitleLanguages": [],
    "subtitleTracks": 0,
    "imageSubtitles": false,
    "styledSubtitles": false,
    "fonts": false,
    "chapters": false,
    "commentaryTracks": 0,
    "commentarySubtitles": 0,
    "audioDescriptionTracks": 0,
    "sdhSubtitleLanguages": [],
    "forcedSubtitleLanguages": [],
    "closedCaptions": false
  },
  "probe": {
    "tool": "ffprobe",
    "version": null,
    "at": "2026-09-19T10:00:00Z",
    "note": null
  }
}
