{
  "schema": "zaentrum.library.extra/2",
  "extraId": "16aa63f3-5555-4666-8777-888888888888",
  "createdAt": "2026-10-06T08:00:00Z",
  "createdBy": "katalog-manager/api",
  "kind": "trailer",
  "title": "Trailer",
  "localizedTitles": {},
  "language": "zxx",
  "runtimeMs": 30000,
  "originalFiles": [],
  "originals": [],
  "packagedFrom": [
    {
      "name": "original.mov",
      "sizeBytes": 3400,
      "fixity": {
        "qh1": "sha256:273dca4a68e0f97ccf4786e2fc911ed0cfed49d195486b9d1829e92ed00a8b81"
      }
    }
  ],
  "container": {
    "format": "mov,mp4,m4a,3gp,3g2,mj2",
    "durationMs": 30000,
    "bitrate": 1066666,
    "title": null,
    "muxingApp": null,
    "writingApp": null,
    "creationTime": null,
    "tags": {}
  },
  "streams": [
    {
      "index": 0,
      "codec": "h264",
      "language": "und",
      "languageRaw": "und",
      "title": null,
      "dispositions": {
        "default": true,
        "forced": false,
        "original": false,
        "dub": false,
        "commentary": false,
        "hearingImpaired": false,
        "visualImpaired": false
      },
      "type": "video",
      "profile": "High",
      "level": 40,
      "bitDepth": 8,
      "pixelFormat": "yuv420p",
      "width": 1920,
      "height": 800,
      "sampleAspectRatio": null,
      "displayAspectRatio": null,
      "frameRate": "24/1",
      "fieldOrder": "progressive",
      "bitrate": null,
      "colour": {
        "primaries": "bt709",
        "transfer": "bt709",
        "matrix": null,
        "range": null
      },
      "hdr": {
        "format": "sdr",
        "masteringDisplay": null,
        "contentLightLevel": null,
        "dolbyVision": null
      },
      "stereo3d": null,
      "closedCaptions": false,
      "encoder": null
    },
    {
      "index": 1,
      "codec": "aac",
      "language": "en",
      "languageRaw": "eng",
      "title": null,
      "dispositions": {
        "default": true,
        "forced": false,
        "original": false,
        "dub": false,
        "commentary": false,
        "hearingImpaired": false,
        "visualImpaired": false
      },
      "type": "audio",
      "profile": "LC",
      "channels": 2,
      "channelLayout": "stereo",
      "sampleRate": 48000,
      "bitDepth": null,
      "bitrate": null,
      "lossless": false,
      "objectAudio": "none",
      "titleClaim": null,
      "encoder": null,
      "purpose": "main",
      "purposeFrom": "assumed",
      "variant": null
    }
  ],
  "fidelity": {
    "class": "unknown",
    "fingerprint": "h264/high/8bit/sdr/1920x800",
    "evidence": []
  },
  "essence": {
    "maxAudioChannels": 2,
    "surround": false,
    "losslessAudio": false,
    "objectAudio": false,
    "maxVideoHeight": 800,
    "videoBitDepth": 8,
    "hdr10Metadata": false,
    "dolbyVision": false,
    "stereo3d": false,
    "interlaced": false,
    "audioLanguages": [
      "en"
    ],
    "subtitleLanguages": [],
    "subtitleTracks": 0,
    "imageSubtitles": false,
    "styledSubtitles": false,
    "fonts": false,
    "chapters": false,
    "commentaryTracks": 0,
    "commentarySubtitles": 0,
    "audioDescriptionTracks": 0,
    "sdhSubtitleLanguages": [],
    "forcedSubtitleLanguages": [],
    "closedCaptions": false
  },
  "probe": {
    "tool": "ffprobe",
    "version": "ffprobe version 7.1",
    "at": "2026-10-06T10:00:00Z",
    "note": null
  }
}
